{
  "version": 4,
  "sourceCard": "source-card.json",
  "asset": {
    "file": "sticker.png",
    "width": 1024,
    "height": 1024,
    "rgba": true
  },
  "pipeline": {
    "backgroundMask": "alpha",
    "outlineWidth": 18,
    "outlineRadius": 42.300000000000004,
    "outlineColor": "#FFB14A",
    "material": "original",
    "tilt": 3,
    "rgbOperation": "source-over-outline-then-material",
    "sourceRgbSha256": "4cf9fb9c9fa24a003da3a42e900f6a70cb7056edbe78697e688b3c7df709b359"
  },
  "verification": {
    "alphaProof": "sticker-alpha-proof.png",
    "alphaMinimum": 0,
    "alphaMaximum": 255,
    "cornerAlpha": 0,
    "visibleCoverage": 0.36079162896848244,
    "softAlphaCoverage": 0.009584426879882812,
    "interiorTransparentPixels": 0,
    "passed": true
  }
}
